Title,Text,central_entity,type
NHS warns against Gwyneth Paltrow’s 'kombucha and kimchi' Covid advice ,"Gwyneth Paltrow has been urged to stop spreading misinformation by the medical director of NHS England after she suggested long Covid could be treated with “intuitive fasting”, herbal cocktails and regular visits to an “infrared sauna”. The Hollywood star, who markets unproven new age potions on her Goop website, wrote on her latest blogpost that she caught Covid-19 early and had since suffered “long-tail fatigue and brain fog”. Paltrow said that after turning to the advice of a “functional medicine practitioner”, she was told “this was a case where the road to healing was going to be longer than usual”. She then embarked on a “keto and plant-based” diet, involving fasting until 11am every day, “lots of coconut aminos” and sugar-free kombucha and kimchi. Paltrow went on to recommend her brand’s Madame Ovary supplement and Seedlip, “the incredible herbal nonalcoholic cocktails”. She added: “I’m doing an infrared sauna as often as I can, all in service of healing.” Paltrow also suggested there was evidence for the efficacy of such a diet. “I’ve been doing major research and finding some great stuff to support what I’m doing,” she wrote. However, her unproven advice prompted a stern rebuke from Prof Stephen Powis, national medical director for NHS England, who urged influencers such as Paltrow against spreading misinformation. He said: “In the last few days I see Gwyneth Paltrow is unfortunately suffering from the effects of Covid. We wish her well, but some of the solutions she’s recommending are really not the solutions we’d recommend in the NHS.” Powis added: “We need to take long Covid seriously and apply serious science. All influencers who use social media have a duty of responsibility and a duty of care around that. “Like the virus, misinformation carries across borders and it mutates and it evolves. So I think YouTube and other social media platforms have a real responsibility and opportunity here.” In 2018 Goop agreed to pay a substantial settlement over unproven claims about the health benefits of the infamous vaginal eggs it was selling. It claimed the eggs could balance hormones, regulate menstrual cycles, prevent uterine prolapse, and increase bladder control, according to officials in Santa Clara, part of a group of California district attorneys who filed the lawsuit. Last year she began selling a This Smells Like My Vagina candle through her Goop brand. She later revealed that the follow-up would be called This Smells Like My Orgasm.",Gwyneth Paltrow,PERFORMER
Wrong Turn review – skull-crushing Appalachian horror,"This horror is pretty crass and generic, yet there is occasionally a wacky gonzo energy to this film by director Mike P Nelson, the seventh movie in the Wrong Turn slasher franchise, which began back in 2003 in the classic 1970s style of The Hills Have Eyes. This is also a reboot or summation in that it is called, simply, Wrong Turn, like the first one, without the number seven. Charlotte Vega plays Jen, a fresh-faced twentysomething hiking the Appalachian trail with a group of her friends. After rashly deciding to go off the official path, into the dense woodland, in search of a “civil war fort” (an ominous destination if ever there was one), they are gruesomely set upon by sinister hillbillies and mountain men dressed in weird animal furs and skulls like Trumpites invading the Capitol. Jen’s earnest dad, Scott (Matthew Modine), comes looking for her, only to discover something horrifying about who these mountain folk actually are and the strange alternative society they have built in secret deep in the forest wilderness for a century or more. This film really is horribly violent, with people getting their skulls crushed, heads bashed in, ribcages collapsed and generally mutilated in all sorts of loathsome ways. It is by-the-numbers stuff, but the film starts to up its game when we find ourselves in the weird proto-postapocalyptic society in the hills that has stayed the same since the 19th century (but which, apparently, was founded on non-racial lines in opposition to the Confederacy and the Union). Jen gets a bit of a story arc that goes a little beyond the survivalist pieties of the Final Girl. It’s a bit silly and queasy, but the narrative motor keeps humming. • Wrong Turn is on digital platforms from 26 February.",Wrong Turn,FILM
The Stylist review – an insipid thriller three decades out of fashion,"Sadly, nowadays there is no video for this to go straight to. Maybe someone should reopen a branch of Blockbuster just so a VHS copy can be ceremoniously placed in a bargain bin by the exit. The Stylist lumbers heavily along as if it’s wearing deep-sea diver’s boots, a queasy mash-up of serial-killer nightmare with 90s-style Single White Female-esque thriller. The acting and directing are entirely terrible, the editing and pacing are so sluggish you’ll feel as if you’re going into a persistent vegetative state, the plot is tiresomely unthought-through, the split-screen shots don’t work and the musical score is so pointless and undifferentiated it sounds like elevator muzak. I do have to admit that the final wedding scene, with one particular cutaway shot of a beaming bridesmaid, does have a certain OTT outrageousness. But that doesn’t justify the price of admission – or of sitting through all that has gone before. Najarra Townsend plays a hair stylist named Claire who is really good at her job. Her way with the scissors and other sharp implements, and her tender scalp caresses, sooth her customers. But she has a habit of offering after-hours haircuts in the salon, giving her customers a late-night glass of wine into which she’s slipped something, and taking Hannibal-style trophies. Then, slightly out of the blue – and this doesn’t really mesh with her creepy MO – Claire forms an obsession with one of her regulars, Olivia (Brea Grant), which this leads to something truly yucky. Exasperatingly, this film fails to tell us something basic: how exactly is Claire moving and disposing of the corpses once she’s done her horrible number on them? Is she burying them? Keeping them in a freezer? One of her victims is the subject of “Missing” fliers put up around town – but later we hear that this same person is getting a “funeral”. So … they found the body? Or what? Either way, this movie has no vital signs. Available from 1 March on Arrow.",The Stylist,FILM
Gatecrash review – opaque auto-accident drama,"Adapted from a play by Terry Hughes, this pent-up and then purgatively violent drama revolves around an offscreen car accident that sends a handful of characters colliding into each other. Clearly already dancing a miserable tango of abuse, Nicole (Olivia Bonamy) and Steve (Ben Cura) come home to their isolated house in the country, decorated in shades of taupe, grey and plum to match Nicole’s bruises, after Steve runs over a stranger on the road on the way home from a party. Though he was driving and chose to leave the scene of the crime, he still blames Nicole for distracting him with an argument. As this display of toxic masculinity approaches its full operatic pitch, suddenly there’s someone at the door: policeman (Samuel West), all creepy chirpy banter, who’s wondering if they’ve seen anything strange lately. There’s quite a lot that’s strange here, including repeated chunks of dialogue that transfer from one character to another, the opaque motivations of several characters, and whether some of this is meant to be fantasy or just heavy-handed melodrama. Plus, there’s a mysterious second-act appearance from another creepy character named Sid, played by Anton Lesser (best known on TV for Game of Thrones and Wolf Hall). Lesser is the best thing in this, giving a layered performance that hints at a backstory that the actor at least may have conceived in detail even if the screenplay, credited to director Lawrence Gough and Alan Pattinson, doesn’t give him much to work with. Perhaps this worked better on stage, but as film it’s neither fish nor fowl, lacking neither the surrealism to give it a Lynchian dream logic, nor the psychological insight to make it work as realism. • Available on digital platforms.",Gatecrash,FILM
The Dark and the Wicked review – devilishly directed farmhouse horror,"The Dark and the Wicked is a nastily effective, lo-fi, psychological haunted house horror about a malevolent force that takes up residence in a remote Texas farmhouse (shot at director Bryan Bertino’s family home). There is possibly not a single scary moment here that will be new to horror fans, but Bertino directs with such technical flair that I yelped at most of them – and half-missed the others, eyes squeezed tight shut. Louise (Marin Ireland) is on a visit back to the farm where her bedridden dad (Michael Zagst) is dying. Her brother, Michael (Michael Abbott Jr), is here too, a hulking lunk in a lumberjack shirt who seems emotionally avoidant, rarely making eye contact. Everything about the farm feels creepy as hell: the sheep bleating in the barn, homemade wind chimes rattling. The land itself has a forsaken feel, abandoned by the younger generation. Refreshingly, Bertino’s emotionally literate script gives the family very real dynamics. Drinking beer on the porch one evening, the siblings experience a stab of guilt, realising how long it’s been since they last visited. What’s strange is that their mother (Julie Oliver-Touchstone) isn’t exactly welcoming. “I told you not to come,” she hisses. In her diary, she’s been writing about a diabolical force taking over the house. The first gruesome scare involves the mother chopping carrots with a very large knife. Worse is to come from the evil presence (named the Wicked in the credits), who the audience sees in the shadows in a couple of blood-run-cold “he’s behind you” moments. Wisely, Bertino exercises restraint, not revealing too much about the Wicked. But that does leave his script open to the accusation of narrative thinness – and with the bodies piling up, you’d expect a cop or two to come sniffing around. • Released on 25 February on Shudder.",The Dark and the Wicked,FILM
Paramount to launch streaming service for new and old films,"Paramount has become the latest studio to unveil plans for a streaming service it hopes will help maximise profits on films whose release has been affected by the pandemic. Paramount Plus, which launches on 4 March, will feature archive content as well as carrying new movies 30 days after theatrical release – or 45 for tentpole titles. These include oft-postponed releases such as Top Gun: Maverick (due in cinemas on 2 July), A Quiet Place II (17 September) and Mission: Impossible 7 (19 November). “Audiences are changing in their habits and we want to make sure that these films are available when they’re fresh after a full theatrical run,” Paramount Pictures CEO Jim Gianopulos told Variety on Wednesday. Mission: Impossible 7 wrapped filming last week after a long-running shoot involving multiple restarts in a wide variety of locations. Post-production is now under way in London ahead of the proposed release over the Thanksgiving weekend holiday in the US. The move is another blow for cinema owners seeking to shore up trade post-lockdown. Disney and Warner Bros have already launched popular streaming services either in tandem with a cinematic release or – particularly in the US, where most venues have been closed for almost a year – as standalone platforms. Universal recently struck a deal with key US chains that would allow them to stream new titles after only 17 days in cinemas. Paramount also announced TV series based on hit movies such as The Italian Job, Love Story, Flashdance and Fatal Attraction.",Paramount,FILM-CREW
"Hellraiser: Judgment review – diminishing, misogynist returns for classic franchise","There have been so many additions to the Hellraiser franchise since the first one debuted in 1987 that we’ve now got to the stage when it’s best not to remind viewers how many there have been, lest the young uns think it’s some kind of musty Gen X thing that just won’t die. Which it kind of is, to be honest. This latest contribution, written and directed by makeup effects specialist Gary J Tunnicliffe, feels like a pretty degraded mutation from the original concept. Where the first few Hellraisers had an interesting if somewhat icky erotic tang to them – alluding to S&amp;M/fetish culture as much as horror, and featuring female protagonists – Judgment is less about desire than just straight-up misogyny and gory, gross-out money shots. The franchise’s iconic demon Pinhead is back once again (of course), played here by Paul T Taylor. But he’s more of a background presence as an assortment of other demons, including one played by Tunnicliffe himself, take over the business of bedevilling humanity via what sounds like insurance industry-based methods of torture, given they call themselves The Auditor, The Assessor and whatnot. Among the living, the main characters are a trio of cops – two of them brothers Sean (Damon Carney) and David Carter (Randy Wayne), as well as rookie Christine (Alexandra Harris) – who are investigating what seems to be a serial killer case. One of the first victims is a young woman (Grace Montie) who dares to be sexually active, and ends up with her lapdog and mobile phone sewn up inside her body. Elsewhere, there’s a trio of supernatural vamps who sit in judgment over souls and have fake blood hosed on to their large naked breasts, which I guess is one way to get your jollies. The dialogue is execrable, which partly excuses the inert performances; the sets – including one that looks like a shop’s filament bulb display – are more interesting to look at than the actors. • Released on 22 February on digital platforms.",Hellraiser: Judgment,FILM
Restless Natives review – classic Scottish comedy is a reminder of a sweeter era,"“Guns are for LASSIES! Nobody seems to put the BOOT in any more!” This rousing manifesto for muscular non-armed crime of the traditional sort comes from one of the hardened villains that surreally pop up in this intensely likable Scottish caper from 1985, with a soundtrack from Big Country. It was part of a boom in Britmovie comedy of the era when Scotland was becoming caustically alienated from Thatcherite England, and which gave us Bill Forsyth’s Gregory’s Girl, Comfort and Joy and Local Hero. The script from Ninian Dunnett was originally the winning entry of a screenwriting competition (Dunnett in fact wrote no more for the screen after this, and became an author and social historian) and it was directed by the anglophile and caledonophile American Michael Hoffman. Joe Mullaney plays Ronnie, a likely Edinburgh lad who works in a joke shop, like Miranda Hart. He and his nervy mate Will (Vincent Friell) decide they’re sick of being poor and resolve to tour around the countryside on their motorbike, in a clown and wolfman disguise, robbing tourist buses – which they do so politely that they become folk heroes. Bryan Forbes and Nanette Newman provide cameos as a grumpy English couple who assume they’re a student “rag week” stunt and fob them off with one of the big 50p coins of the day. But when the lads’ criminal career takes off, a mean American cop over here on holiday, played by Ned Beatty, gets on their trail with his flashy big mobile phone (“It’s the Man from UNCLE!” giggle the local officers) and tension emerges between the two bandits. Will finds himself romantically involved with Margot (Teri Lally), a tour guide on a bus he’d just stuck up, and Ronnie falls in some with serious villains, led by a deadpan Mel Smith. Kids keep cropping up in the action – unsentimental and unimpressed by both the cops and the robbers. It’s the kind of gentle and yet sweetly funny use of children that British cinema just doesn’t do any more. Ronnie and Will are in some ways innocent forerunners of Renton, Spud et al in Trainspotting, and also a prototype Wallace and Gromit. Released on 1 March on digital platforms.",Restless Natives,FILM
Advice on fasting is just slowing down | Brief letters,"I am not surprised that students expressed some doubts about replacing exams with teacher assessments (‘I’d 100% prefer to sit exams’: pupils on teacher-assessed grades, 25 February). When I was at school in 1964, my headteacher asked me if the rejections of my applications to study medicine were complete yet. I qualified at UCH London in 1970. Dr Colin Morison Canon Pyon, Hereford • The Common Sense Group of Conservative MPs presumably chose its name through careful study of the Marxist philosopher Antonio Gramsci’s works. “Common sense is a chaotic aggregate of disparate conceptions, and one can find there anything that one likes.” Peter Brooker West Wickham, Kent • Gwyneth Paltrow recommends “fasting until 11am every day” as part of a diet to combat long Covid (NHS warns against Gwyneth Paltrow’s ‘kombucha and kimchi’ Covid advice, 24 February). I regularly eat breakfast well after 11am these days since I see little point in getting out of bed before that time. Does this count? Tony Purcell Sheffield • Bob Marley and the Wailers’ 1975 Live! album, arguably the second-best live album of all time after The Band’s The Last Waltz, appears to be missing from your list (From Daft Punk and Beyoncé to the Band: 10 of the best ever live albums, 26 February). Surely a mistake. Toby Wood Peterborough, Cambridgeshire • Never mind the first snowdrop or cuckoo (Letters, 16 February) – we’ve got washing on the line in West Yorkshire. Beat that. Dr Mark Wilcox Holmfirth, West Yorkshire",None,OTHERS
Moxie review – Amy Poehler's high-school comedy plays it straight,"A high-school movie directed by Amy Poehler, the SNL comedy blackbelt who starred in Parks and Recreation? And who is incidentally the longtime performing partner of Tina Fey, who created the high-school classic Mean Girls? Is this going to be hilarious, or what? Sadly no. Solemnly based on a novel by YA author Jennifer Mathieu, Moxie could be called Nice Girls or Mutually Supportive Girls. Poehler herself has a small role as the single mom of a smart, lonely teenage girl called Vivian (Hadley Robinson) who is best friends with Claudia (Lauren Tsai), but whose intimacy with her is about to be damaged by her admiration for supercool new girl Lucy (Alycia Pascual-Peña), and her growing romantic situation with the impeccably right-on and pro-feminist supportive guy Seth (Nico Hiraga). Enraged by the boorish, sexist behaviour of the obnoxious football star Mitchell (Patrick Schwarzenegger), and the way he is indulged by the school, Vivian gets inspired by her mom’s long-since forgotten protest persona, and she starts a zine called Moxie and triggers a feminist revolution at the school which challenges her friendships and her sense of herself. The film is intensely, almost radically humourless, which is hard to ignore and in fact hard to bear, because of this film’s obvious resemblance to recent great movies like Booksmart or Lady Bird and particularly at times the hard-edged classic Election. In fact, Moxie feels like someone has put those films through a machine for extracting the comedy and the political satire. The movie tackles diversity, bullying and rape, but does it all very glibly. The target audience will surely be aware of the canon of superior, funny movies – and they will be baffled to see that Poehler doesn’t want to do something similar. • Released on 3 March on Netflix.",Moxie,FILM
Body Brokers review – drug abusers feed addiction to profit,"While films such as Traffic and Sicario focused on the supply side of the US war on drugs, John Swab’s third feature takes on the demand part of the equation. An expletive-spattered prologue fills us in on how the Obamacare act’s obligation for healthcare-providers to cover drug-abuse treatment created a market for recovery facilities worth $12bn a year in southern California alone. Swab then zeroes in on pasty Ohio junkie Utah (Jack Kilmer), plucked from heroin deadendsville and offered free rehab on the west coast by Wood (Michael Kenneth Williams), a broker acting on behalf of treatment centres to find addicts whose stay will be funded by insurance companies. After completing the programme, Utah graduates to becoming an apprentice to Wood and quickly realises the size of the fraud at hand. Wood hauls in patients at scale by offering them a cut of the insurance money; the system has no incentive to see them permanently recover because relapsing addicts mean repeat business. Wood also runs the same ploy on subcutaneous implants that inhibit opiate addiction, delivering a stream of punters worth $60,000 each to a local surgeon. The cynicism and human collateral of it all makes it the narco-industrial complex’s version of sub-prime. Emblazoned with mouthy Big Short-style info-dumps, and with a phone-selling scene reminiscent of The Wolf of Wall Street, Body Brokers outwardly seems to be aiming for high Scorsesian amoral operatics. But given the originality of Swab’s take, it’s a shame he couldn’t find the film a more appropriate style: at heart it is a more sober film intent on declaring its outrage. Kilmer, son of actors Val and Joanne Whalley, is a little bland in the ingenue role, not really digging into the sense that something malignant squirms beneath: not just substance dependency but also American addiction to capitalism – as hinted at by two uses of Public Image Ltd’s Rise on the soundtrack, with its cry that “anger is an energy”. But the Mephistophelean Wood is a great role for Williams; another man running game on the system, like his Omar from The Wire, but the moral compass long since pawned off. • Released on 8 March on digital platforms.",Body Brokers,FILM
"Lucky review – home-invasion horror that's a stand against violence, on repeat","This clever thriller teeters on the brink of abstraction, and walks a razor wire between horror and an incredulous absurdity meant to stand for how women must live in the modern world: the daily toll of living in fear of aggression, physical assault and withstanding the misogynistic structures that excuse them. At 2.29am one night, writer May (Brea Grant) peers over her balustrade to see an interloper, features blurred by a gel mask, staring up at her from the backyard. When she retreats to bed to tell husband Ted, he is disturbingly blase: “Honey, that’s the man. The man that comes every night and tries to kill us.” Ted manages to off the housebreaker with a pool cue, but his body disappears within seconds. The next night, and the next, May must do it all over again. As this Groundhog Day home invasion unspools, other characters display the same weird acceptance as Ted. More than the physical threat, it’s as if a new unfathomable reality is creeping in and violating her own. The police response is half-hearted and, adding to the conspiratorial air, Ted packs his bags after an argument: “I can’t change this. This is just how things are.” After these microaggressions, the next macro one is incoming; you might expect an It Follows-style air of inexorable dread to set in, but May remains upbeat. Grant also wrote the script as well as starring, and perhaps it’s this closeness to the core ideas that allows her to pivot spryly between romcom perkiness and a nauseated hesitancy that suggests the dislocation between normal life and its violent substrate. Towards the end, there’s a suggestion that May’s public tough-it-out credo – she is plugging a self-help book called Go It Alone – may be, in some sense, perpetuating these attacks. Possibly this is acknowledging that the strong-woman ideal championed by some quarters of the #MeToo movement comes at the expense of a more realistic and collaborative feminism. Natasha Kermani’s film is an elliptical but vehement statement on the post-#MeToo landscape. If the film’s story development is stymied by the narrative’s ultimate stasis, it is to all the better point out that the fight is far from finished. • Released on 4 March on Shudder.",Lucky,FILM
